location,date,headline,crime_type,article,age,businessman,percentile
narela,2019-09-15	2019-09-16	2019-09-16	2019-09-16	2019-10-24,Criminal wanted in murder cases arrested within 24 hrs	Gogi: Killer who returned a year after 4 murders	Delhi’s most wanted named in murder of history-sheeter	Delhi: Wanted criminal arrested in connection with Narela murder case	Scribe covering ‘robbery’ says was manhandled by SI | Noida News - Times of India,murder	murder	murder	murder	robbery,"The Delhi Police on Sunday arrested a man, allegedly wanted in six murder cases, within 24 hours of initiating a lookout.

According to the police, the accused, identified as Javed, was nabbed from North Delhi's Narela area. They have also seized one loaded country-made pistol from his possession, which was allegedly used to commission the crime.

""Considering the seriousness of the crime, many teams of Police were constituted by Assistant Commissioner of Police (ACP),"" the police said in a statement.

The 25-year-old was caught after the teams conducted raids at the ""possible hideouts"" of the accused at various places in New Delhi and Haryana.	Fifteen months after he shot dead three rival gangsters on a busy road in north Delhi’s Burari, Jitender Gogi — one of Delhi’s most wanted gangsters — has allegedly been named in the daring shootout in Narela on September 8 in which Virender Mann, a history sheeter, was killed. Police claimed that witnesses has identified one of the shooters as Jitender Gogi. Along with two aides, Gogi allegedly intercepted Mann’s car and pumped in 20 bullets in his body. Police said Gogi was last seenin Burari shootout in which a passeby woman was also killed. He had been on the run. With at least a dozen cases, including murder and extortion, Gogi carries a reward of Rs 4 lakh on his arrest. He was last arrested in 2016, but had fled police custody within three months. Police have also registered a case under the stringent MCOCA (Maharashtra Control of Organised Crime Act) Act against him. Police officers who are trying to hunt Gogi down said he does not use one phone for long and changes his hideouts almost every other day. Police have in the past traced his location to Nepal and the other neighbouring states in north India. A police officer, who did not wish to be named, said booking Gogi under MCOCA means that on his arrest, he will not be bailed out easily and other criminals or associates sheltering him will also be booked. Further, the stringent law allows police to attach his properties acquired through illegal means, further weakening the activities of his gang, the officer said requesting anonymity.Gogi’s involvements have surfaced in crimes such as murders, attempts to murder, extortion, possession of illegal arms, carjacking and land grabbing.Investigation in several cases against the gangster shows that it was Gogi, his right hand Kuldeep Fajja and their gang member Rohit Moi who were involved in September 8 shoot out in which Virender Mann was killed. The trio’s name also surfaced in Burari shootings last year .Gogi was not always the most feared gangster. He was once a bright student at Delhi university. It was while studying in Swami Shraddhanand College that Gogi developed enmity with another student, Sunil alias Tillu, whose associates had allegedly beaten Gogi’s friend who was contesting college elections. The rival candidate was Tillu’s cousin. Gogi’s friend then withdrew his name and Tillu’s cousin won the elections.This incident gave birth to an alleged rivalry between Gogi and Tillu that has claimed more than 10 lives from both the groups over the past decade. While Gogi, last arrested in 2016 managed to flee from police custody, Tillu is currently in jail.	The murder of Virender Mann, former BSP MLA candidate from outer Delhi’s Narela, who succumbed to at least 20-25 gunshot wounds earlier this month, was allegedly orchestrated by Delhi’s most wanted gangster Jitender Gogi and his associate Kapil Mann, police said Monday. Police said they have arrested Kapil for the murder and said Virender’s killing was a retaliation against another murder last year — an associate of Neeraj Bawana had allegedly gunned down one Babloo Kheda, who was Kapil’s uncle.On September 8, five men had reportedly intercepted Virender’s Hyundai Creta on Lampur Road in Outer Delhi’s Narela and sprayed 30-40 bullets at his car, while he was seated beside the driver. As many as 20-25 bullets hit Virender, killing him on the spot, while his driver miraculously escaped the firing.Virender, who had contested the assembly elections from Narela on a BSP ticket in 2013 and lost, had 13 cases registered against him, including those of murder, attempt to murder, robberies, extortion and under the Arms Act.A senior police officer probing Virender’s murder said they got sketches of suspects made with the help of locals and witnesses and found that Gogi and Kapil, who carries a reward of ₹1.25 lakh on his arrest, were present at the spot of the crime during the shooting.DCP(outer north) Gaurav Sharma said their surveillance led police teams to an input that Kapil, a resident of Kheda Khurd village, will be reaching Sector 34 near the Kheda canal on Sunday. “On this input, our special staff team laid a trap and Kapil was arrested. He was carrying a reward of ₹1.25 lakh on his arrest for his involvement in three murders, one attempt to murder, three robberies and one Arms Act case,” the DCP said.Sharma said during questioning, Kapil disclosed that on September 8, he and his men were tailing Virender’s car and when they saw Virender’s car stuck in a traffic jam, he and his associates fired indiscriminately at that vehicle. “Efforts to arrest the other suspects are being made. Among the other suspects, we have so far identified Kuldeep Fajja, who is Gogi’s confidant, and gang member Rohit Moi,” the DCP said.Another officer associated with the investigation said further interrogation of the arrested men revealed that Virender’s killing was the fallout of a murder that took place last year.“On July 31, 2018, 46-year-old Babloo Kheda was gunned down in northwest Delhi’s Ashok Vihar. One Parvesh Mann, who was backed by gangster Neeraj Bawana, was the prime suspect. Later, in October, police arrested Parvesh Mann. Investigations revealed that the car in which he was arrested had been given to him by Virender. Kapil, the nephew of Babloo Kheda, came to know that Virender also had a role in his uncle’s murder. He told us that Virender was killed to settle scores with Bawana for plotting his uncle’s death,” the officer, requesting anonymity, said.	The police on Sunday solved a murder case by arresting a criminal who was also wanted in seven other cases of murder.

""A team of special staff of Outer North district consisting of Sub Inspector Kamlesh, Assistant Sub Inspector Ombir, Head Constable Joginder, Constable Dinesh, Constable Hanuman and Constable Ravikant in the leadership of Inspector Ajay worked out the sensational murder case of Virender alias Kala with the arrest of one criminal Kapil Mann (25),"" DCP Outer North Delhi, Gaurav Sharma said.

Virender was killed after Mann fired at him indiscriminately near Sadabad in Narela.

The accused was carrying a reward of Rs 1,25,000 on his head. He has been arrested under Section 302 of the Indian Penal Code (IPC). He was wanted in eight cases of murder, attempt to murder and robbery etc.

He was arrested from Sector 34 area, near Kheda canal here.

Efforts are on to recover the weapon of offence. Further investigation is underway.	Greater Noida: A fake robbery and misbehaviour with a journalist turned the Dankaur police station into a protest site on Wednesday. First, a tractor driver allegedly made off with farmers’ money he claimed had been stolen. Then, a journalist who was covering the case was allegedly manhandled by a sub inspector.It started with Deepak Singh, 23, who was on his way back from a grain market in Delhi’s Narela after selling wheat on behalf of several farmers. Around 9.20am, Mukesh Tayal, the tractor owner, got a call from Deepak, telling him that the bag with Rs 6,7 lakh in cash had been looted by three men on a bike who overpowered him near Sports City. At 9.30am, police arrived at the spot. “Deepak claimed only Rs 4,000 was looted,” a senior police officer told TOI. Then, Tayal got there. Meanwhile, CCTV footage showed no bike around the tractor along the stretch. Police started searching the tractor and said Deepak fled during the search, while Tayal alleged they had deliberately let him go. Around 11am, Anshu Chauhan, a local journalist, reached to cover the case. “I was at Dankaur police station to find out about the case. I was sitting near a staircase when sub-inspector Dinesh Kumar started arguing with me, snatched my phone and smashed it. He thought I was trying to take a video. When I told him I was not, he held me by the collar,” Chauhan said.The news spread, a group of mediapersons told the Dankaur SHO what happened. But before he could arrive, local journalist Mustkin Khan said, constable clerk Pappu Khan abused them and threatened to jail them. The place then turned into a site of two protests – one by journalists and another by farmers, who had converged there demanding their money. Deepak was finally arrested near Palwal around 6am on Wednesday. The farmers were still on protest till late evening.An FIR has been lodged against Deepak for criminal breach of trust, SP (rural) Ranvijay Singh said. Tayal, however, told TOI he and another farmer spoke to Deepak, who said he had handed the money to the police. Singh said that the constable clerk had been transferred earlier. No action has been taken against the sub-inspector as of now.",25	-1	46	-1	-1,0	0	0	0	0,17
wazirabad,2019-09-15	2019-10-15,"Four men booked for kidnapping and beating 13-year-old boy in Wazirabad	Two involved in over dozen cases of robbery in UP, Delhi nabbed after shootout",kidnapping	robbery,"Four men were booked for allegedly beating and kidnapping a 13-year-old boy as they suspected him of stealing a mobile phone at the Dhani market in Wazirabad on Friday. The police said that the boy’s father was also beaten up by the men.According to the police, the boy is a Class 8 student and a resident of Wazirabad. His father is an auto-rickshaw driver and his mother runs a shop of cosmetic products near their residence. The incident took place on Thursday around 12.30pm when the boy was playing at a neighbouring house. In the police complaint, his father alleged that he saw his neighbours beating the boy when he returned home after work. On enquiring, they alleged that the boy had stolen a mobile phone from their house. “Two more men came to the spot and began kicking and punching me. I fainted at the spot because of the beating,” the boy’s father stated in the first information report (FIR). He added that the men allegedly kidnapped his son. Deepak Kumar, station house officer (SHO), Sector 53 police station, said, “We are trying to find the boy. No suspect has been arrested yet. We are investigating the case.”A case was registered under sections 323 (voluntarily causing hurt), 34 (act done by several persons in furtherance of common intention), 365 (kidnapping) and 506 (criminal intimidation) of the Indian Penal Code (IPC) at Sector 53 police station on Friday.	Two men involved in over a dozen cases of robbery and snatching have been nabbed by the Special Cell of Delhi Police following a shootout at Wazirabad Burari road on Tuesday night, police said.

Police uniforms, two pistols and a motorcycle were seized from them.

The incident took place at around 10.15 pm when a police team stationed on Wazirabad-Burari road near Jagatpur flyover spotted a motorcycle coming from Wazirabad side and signalled it to stop but the bike-borne miscreants opened fire on police team, they said.

The duo fired four rounds, forcing police to retaliate resulting in one of the accused, later identified as Ravi (26) suffering bullet injury in his leg, they said.

The second accomplice, Mustakin (51) was apprehended unhurt, the police said.

The injured was admitted to a nearby hospital, a senior police official said.",13	-1,0	0,67
burari,2019-09-16,Gogi: Killer who returned a year after 4 murders,murder,"Fifteen months after he shot dead three rival gangsters on a busy road in north Delhi’s Burari, Jitender Gogi — one of Delhi’s most wanted gangsters — has allegedly been named in the daring shootout in Narela on September 8 in which Virender Mann, a history sheeter, was killed. Police claimed that witnesses has identified one of the shooters as Jitender Gogi. Along with two aides, Gogi allegedly intercepted Mann’s car and pumped in 20 bullets in his body. Police said Gogi was last seenin Burari shootout in which a passeby woman was also killed. He had been on the run. With at least a dozen cases, including murder and extortion, Gogi carries a reward of Rs 4 lakh on his arrest. He was last arrested in 2016, but had fled police custody within three months. Police have also registered a case under the stringent MCOCA (Maharashtra Control of Organised Crime Act) Act against him. Police officers who are trying to hunt Gogi down said he does not use one phone for long and changes his hideouts almost every other day. Police have in the past traced his location to Nepal and the other neighbouring states in north India. A police officer, who did not wish to be named, said booking Gogi under MCOCA means that on his arrest, he will not be bailed out easily and other criminals or associates sheltering him will also be booked. Further, the stringent law allows police to attach his properties acquired through illegal means, further weakening the activities of his gang, the officer said requesting anonymity.Gogi’s involvements have surfaced in crimes such as murders, attempts to murder, extortion, possession of illegal arms, carjacking and land grabbing.Investigation in several cases against the gangster shows that it was Gogi, his right hand Kuldeep Fajja and their gang member Rohit Moi who were involved in September 8 shoot out in which Virender Mann was killed. The trio’s name also surfaced in Burari shootings last year .Gogi was not always the most feared gangster. He was once a bright student at Delhi university. It was while studying in Swami Shraddhanand College that Gogi developed enmity with another student, Sunil alias Tillu, whose associates had allegedly beaten Gogi’s friend who was contesting college elections. The rival candidate was Tillu’s cousin. Gogi’s friend then withdrew his name and Tillu’s cousin won the elections.This incident gave birth to an alleged rivalry between Gogi and Tillu that has claimed more than 10 lives from both the groups over the past decade. While Gogi, last arrested in 2016 managed to flee from police custody, Tillu is currently in jail.",-1,0,84
chittaranjan park,2019-09-24,DCW issues notice to Delhi Police in female journalist robbery matter,robbery,"New Delhi, Sept. 24 -- Delhi Commission for Women has sent a notice to the Delhi Police to update the commission regarding the incident wherein a female journalist was allegdly pulled out of a moving auto rickshaw and robbed of her mobile phone by two bike borne miscreants.
The commission has sought a detailed status report of the probe into the matter by Saturday including the copy of FIR in this matter and asked the police to inform about the steps taken towards identification of the accused persons.
The commission has also asked for the CCTV footage inconnection with the incident.
The commission said that the matter is very serious and such incidents of chain snatching and subsequent assaults especially on women and girls are on rampant rise in Delhi.
The victim journalist had also informed the DCW saying that on Sunday at around 1815 hours when she was traveling by an auto rickshaw , two bike borne men drove next to her and forcibly dragged her out in a bid to snatch her phone and during this she fell on the road getting severely injured.
The victim is currently being treated at the All India Institute of Medical Sciences.
Meanwhile , the Delhi Police South District has constituted multiple teams to act swiftly in the matter , while senior officers have met the victim and are supervising the investigation into the matter.
The incident took place in the Chittaranjan Park area.
UNI APS ADG 1602 Published by HT Digital Content Services with permission from United News of India. For any query with respect to this article or any other content requirement, please contact Editor at contentservices@htlive.com",-1,0,84
