location,date,headline,crime_type,article,age,businessman,percentile
kashmiri gate,2019-09-06	2019-09-07	2019-09-07	2019-09-08,"Goa swimming coach, accused of rape, arrested in Delhi	Rape case: Goa cops get transit remand of swimming coach	Rape case: Swimming coach brought to Goa	Rape case: Swimming coach sent in 6-day police remand",rape	rape	rape	rape,"Swimming coach Surajit Ganguly, who has been accused of raping a 15-year-old girl who was training with him, was arrested in New Delhi on Friday, a senior police official said here.

Superintendent of Police (North) Utkrisht Prasoon told PTI that Ganguly was held in New Delhi's Kashmiri Gate area.

Goa Police on Thursday registered a case of rape against Ganguly, who was employed with the Goa Swimming Association (GSA). He had been untraceable since.

Prasoon said the girl's father had first approached Rishra Police Station in Hoogly district of West Bengal with the complaint against the coach.

Both the girl and the accused hail from West Bengal.

The complaint said the incident had happened at Mapusa in Goa.

After the complaint was filed, North Goa District Police immediately sprang into action, the complaint was obtained through e-mail, and a first information report (FIR) was immediately registered at Mapusa police station, the SP said.

Ganguly's movements were tracked using technical surveillance and local intelligence, Prasoon said.

""It was found that the accused was traveling to different cities to evade arrest,"" he added.

A case of rape, molestation and criminal intimidation under the IPC, as well as for offences under the Protection of Children from Sexual Offences (POCSO) Act was registered against Ganguly at Mapusa police station on Thursday.

A purported video of the crime had gone viral on social media, prompting Union Sports Minister Kiren Rijiju to promise a stringent action against him. The Goa Swimming Association also sacked him.

On Friday, the Swimming Federation Of India banned Ganguly from all activities related to the sport.

""Based on a report filed with the SFI's Goa unit and corroborated by evidence on social media, the SFI condemns this heinous behaviour and has banned this coach from any form of coaching or other activities related to the sport across India. Circular to this effect is issued to all its 29 state units,"" the federation said in a statement.	A court in Delhi on Saturday granted Goa police the transit custody of swimming coach Surajit Ganguly, accused of raping a 15-year-old girl training with him, till September 10, police said.

Ganguly, who was on the run since the case was registered, was arrested from Kashmiri Gate area in New Delhi on Friday.

""The accused was produced before Tis Hajari court in New Delhi which remanded him in a three-day transit remand of Goa police this noon,"" deputy superintendent of police, Gajanan Prabhudesai, told PTI.

He said Ganguly would be flown to Goa and produced before a children's court later in the day.

Ganguly was employed with the Goa Swimming Association when the alleged incident took place in Mapusa.

Father of the girl had approached Rishra police station in Hooghly district of West Bengal against Ganguly, a senior police officer had said.

He said the police had obtained a complaint from West Bengal police via e-mail and registered an FIR.

Ganguly has been booked under section 506 (Punishment for criminal intimidation) of the Indian Penal Code (IPC) and various sections of the Protection of Children from Sexual Offences (POCSO) Act and Goa Children's Act.	Swimming coach Surajit Ganguly, accused of raping a 15-year-old girl training under him, was brought to Goa late on Saturday night after the state police was granted three-day transit custody of the accused by a Delhi court.

Ganguly, who had been on the run since the case was registered, was arrested from the Kashmiri Gate area in New Delhi on Friday.

""The accused was produced before Tis Hajari court in New Delhi which remanded him in a three-day transit remand of Goa police Saturday noon,"" deputy superintendent of police, Gajanan Prabhudesai, told PTI.

Ganguly was employed with the Goa Swimming Association when the alleged incident took place in Mapusa.

The father of the girl had approached Rishra police station in Hooghly district of West Bengal against Ganguly, a senior police officer had said.

He said the police had obtained a complaint from West Bengal police via e-mail and registered an FIR.

Ganguly has been booked under section 506 (Punishment for criminal intimidation) of the Indian Penal Code (IPC) and various sections of the Protection of Children from Sexual Offences (POCSO) Act and Goa Children's Act.	A Goa court on Sunday remanded swimming coach Surajit Ganguly, arrested for allegedly raping a minor girl training under him, in police custody for six days.

Ganguly, who was was on the run since the case was registered, was arrested in New Delhi on Friday and brought to Goa late Saturday night following which he was taken to Mapusa police station, where the offence was registered against him.

""On Sunday morning, he was produced before the judicial magistrate first class at Mapusa for the remand. He has been remanded in six-day police custody,"" Deputy Superintendent of Police Gajanan Prabhudesai told PTI.

Goa police were earlier granted three-day transit custody of the accused by a Delhi court.

Ganguly was employed with the Goa Swimming Association when the alleged incident took place in Mapusa.

The girl's father had approached Rishra police station in Hooghly district of West Bengal against Ganguly, a senior police officer earlier said.

The Goa police later got the complaint from their West Bengal counterparts via e-mail and registered an FIR.

After the case was registered, Ganguly travelled to different states. The Goa police then sent teams to different locations to nab the him.

Ganguly was finally apprehended from the Kashmiri Gate area in New Delhi on Friday, Superintendent of Police (North Goa) Utkrisht Prasoon said.

He was booked under Indian Penal Code Section 506 (criminal intimidation) and provisions of the Protection of Children from Sexual Offences (POCSO) Act and the Goa Children's Act.",15	15	15	-1,0	0	0	0,34
geeta colony,2019-09-08,"Delhi: Gang-rape accused tries to gun down survivor, held | Delhi News - Times of India",rape,"NEW DELHI: A man, who was involved in the gang rape of a girl, was arrested when he tried to kill the survivor when she was on her way to depose before a magistrate at Rohini court.Police also recovered a double-barrel pistol from the accused’s possession.He had earlier lured the survivor to an apartment on the pretext of celebrating her friend’s birthday and then, along with his friends, raped her at gun point. The accused had been on the run after the girl approached the police with a complaint.According to police, accused Kasim alias Raji Ahmed was earlier involved a shootout at a police party near Geeta Colony. He had been arrested and booked under the Arms Act. After being released from jail, he came in contact with a friend of the survivor and forced him to lure her to an apartment in Rohini, where the sexual assault took place.On July 26, the accused’s friend called the girl to accompany him to a birthday party. When the girl reached the apartment, Kasim and his friends were already present. There, the men held her at gunpoint and took turns to rape her. When the survivor tried to raise an alarm, the men threatened to kill her and her family members.A few days later, the survivor got an FIR registered against Kasim and his friend after which a manhunt was launched to nab the accused.On realising that the police were after him, Kasim started evading them. “He procured a double-barrel pistol and decided to eliminate the girl to prevent her from recording her statement before a court,” said a police officer.However, the girl came to know about Kasim’s intention and informed the cops after which a trap was laid and the accused was nabbed.Kasim, a Class X dropout, is a resident of Kirari and is a history-sheeter, said a cop.",-1,0,84
rohini,2019-09-08	2019-09-27	2019-10-03	2019-10-03,"Delhi: Gang-rape accused tries to gun down survivor, held | Delhi News - Times of India	Cafe fight led to businessman’s murder in Dwarka: Cops | Delhi News - Times of India	Delhi: Wanted in a robbery case, man arrested after he uploads picture on Facebook | Delhi News - Times of India	Wanted in a robbery case, man arrested after he uploads picture on Facebook",rape	murder	robbery	robbery,"NEW DELHI: A man, who was involved in the gang rape of a girl, was arrested when he tried to kill the survivor when she was on her way to depose before a magistrate at Rohini court.Police also recovered a double-barrel pistol from the accused’s possession.He had earlier lured the survivor to an apartment on the pretext of celebrating her friend’s birthday and then, along with his friends, raped her at gun point. The accused had been on the run after the girl approached the police with a complaint.According to police, accused Kasim alias Raji Ahmed was earlier involved a shootout at a police party near Geeta Colony. He had been arrested and booked under the Arms Act. After being released from jail, he came in contact with a friend of the survivor and forced him to lure her to an apartment in Rohini, where the sexual assault took place.On July 26, the accused’s friend called the girl to accompany him to a birthday party. When the girl reached the apartment, Kasim and his friends were already present. There, the men held her at gunpoint and took turns to rape her. When the survivor tried to raise an alarm, the men threatened to kill her and her family members.A few days later, the survivor got an FIR registered against Kasim and his friend after which a manhunt was launched to nab the accused.On realising that the police were after him, Kasim started evading them. “He procured a double-barrel pistol and decided to eliminate the girl to prevent her from recording her statement before a court,” said a police officer.However, the girl came to know about Kasim’s intention and informed the cops after which a trap was laid and the accused was nabbed.Kasim, a Class X dropout, is a resident of Kirari and is a history-sheeter, said a cop.	In the CCTV footage, Nakul Sangwan can be seen climbing a car parked near the businessman’s car to shoot him d...

Accused Says They Got Thrashed At Cafe

NEW DELHI: The sensational murder of a property dealer turned politician, who was shot dead in Dwarka on Tuesday by two assailants in a daring attack captured on CCTV camera, was a fallout of a fight that took place in a cafe run by the victim, police said after arresting one of the alleged shooters on Thursday.The victim, Narendra Gehlot, had contested the last municipal elections as an independent and lost. He had slapped the shooter, Nakul Sangwan, at his cafe after locking him up following an altercation, police said. Sangwan, who is the cousin of gangster Kapil Sangwan, was nursing a grudge against Gehlot ever since, and decided to eliminate him to avenge the insult, police added.Police arrested Sangwan near Dwarka on Thursday after laying a trap. DCP (Dwarka) Anto Alphonse said a team led by ACP Rajinder Singh confronted Sangwan near Goyla Dairy. When he saw the police team, Sangwan tried to whip out his pistol and fire but was overpowered by the team. The .32 bore pistol he had used for the murder was recovered from him.Cops found that Sangwan was earlier involved in another murder in Aman Vihar near Rohini. The victim was a youth named Pushkar, whom Sangwan suspected of passing on information to his rivals about the movement of the family members of one of his associates. That murder too was captured in a CCTV camera.During interrogation, Sangwan told the cops that in July this year, he and his friend Rohit had gone to a cafe run by Gehlot’s relatives on the third floor of his office near Dwarka More. Rohit had a running dispute with Gehlot and his relative, claiming that he had lent them money for the cafe which Gehlot had refused to return.Finding them sitting in the cafe, Gehlot challenged them which led to an argument during which he allegedly shut the door and called in a few of his employees to thrash Sangwan and Rohit. Angered by the insult, Sangwan was looking for an oppurtunity to take revenge and had kept a watch outside Gehlot’s shop to track his movements, police said.On Tuesday, he and one of his associates waylaid Gehlot while he was leaving his shop, and started firing at his car. When Gehlot tried to flee, Sangwan climbed on a car parked near Gehlot’s car and shot him dead.Sangwan told cops that he had dropped out of a Haryana college while pursuing a BSc course. He was inspired by his cousin Kapil, who has been absconding for the past few years. He had joined Kapil’s gang and was a notorious sharpshooter of the Nandu gang. He was arrested last year in a murder case at Baba Haridass Nagar, and was released from the jail in June 2019. Sangwan had started extorting money from businessmen in Dwarka and adjoning areas.Police are now on the lookout for his associate, who had also fired at Gehlot.	NEW DELHI: A 21-year old man found himself in jail after he uploaded a picture of himself on vacation in Shimla that he had funded by allegedly robbing three people at gunpoint in a Delhi suburb, police said on Thursday.The accused has been identified as Subham, who was arrested from a market in Shimla after he uploaded his picture on Facebook He along with his friend and an acquaintance had planned and executed a robbery on September 23 to finance the trip to Shimla, they said. Mohit Singh lodged a complaint with the police and alleged that he was robbed by three persons of Rs 1,500. He also alleged that the miscreants robbed Rs 23,000 from his uncle and around Rs 2,500 from a locker of the shop at Rohini sector-3 at gunpoint.The incident took place at around 9.30pm when the victims were busy closing the shop, police said.When they were about to close the shop, two men entered while one stood outside. They started thrashing Singh and his uncle and took away cash at gunpoint before fleeing the spot, a police official said.During investigation, police detained some of the friends of the accused. The friends told the police that Subham and his associates were in Shimla on a holiday and had also uploaded a picture on Facebook, the official said.""Subham, a resident of Pitampura was arrested from Shimla. Efforts are being made to nab his associates,"" said Deputy Commissioner of Police (Rohini) SD Mishra.During interrogation, the accused disclosed that they had planned and executed the crime to finance their sight seeing trip to Shimla, the officer said.The accused was arrested earlier as well in a robbery case, the officer added.	A 21-year old man found himself in jail after he uploaded a picture of himself on vacation in Shimla that he had funded by allegedly robbing three people at gunpoint in a Delhi suburb, police said on Thursday.

The accused has been identified as Subham, who was arrested from a market in Shimla after he uploaded his picture on Facebook.

He along with his friend and an acquaintance had planned and executed a robbery on September 23 to finance the trip to Shimla, they said.

Mohit Singh lodged a complaint with the police and alleged that he was robbed by three persons of Rs 1,500. He also alleged that the miscreants robbed Rs 23,000 from his uncle and around Rs 2,500 from a locker of the shop at Rohini sector-3 at gunpoint.

The incident took place at around 9.30 pm when the victims were busy closing the shop, police said.

When they were about to close the shop, two men entered while one stood outside.

They started thrashing Singh and his uncle and took away cash at gunpoint before fleeing the spot, a police official said.

During investigation, police detained some of the friends of the accused. The friends told the police that Subham and his associates were in Shimla on a holiday and had also uploaded a picture on Facebook, the official said.

""Subham, a resident of Pitampura was arrested from Shimla. Efforts are being made to nab his associates,"" said Deputy Commissioner of Police (Rohini) SD Mishra.

During interrogation, the accused disclosed that they had planned and executed the crime to finance their sight seeing trip to Shimla, the officer said.

The accused was arrested earlier as well in a robbery case, the officer added.",-1	-1	-1	-1,0	1	0	0,34
kirti nagar,2019-09-08,"Friend, tutor accused of rape in two FIRs | Gurgaon News - Times of India",rape,"Gurgaon: A 20-year-old student from Delhi has accused a private firm employee she had befriended recently of raping her at his home in Sector 82. The woman has told police she had been in touch with Vivek for over a month and spoke to each other regularly.Last week, Vivek allegedly met the woman at a metro station, took her home and raped her there. The woman, who is from Delhi, studies and works in a private company. The accused is employed with a private firm in Gurgaon. “The complaint was filed in Delhi’s Kirti Nagar, where the woman lives. The zero FIR has been transferred to us as the alleged rape took place in our jurisdiction,” the investigating officer said. An FIR has been registered under Section 376 of the IPC (rape).In another case, a student has accused her tutor of raping her and recording an obscene video. The accused allegedly blackmailed her using the video for two and a half years. The girl has told police she would go for tuitions to one Vishal Singh. On one occasion, the accused allegedly laced her drink with some sedatives and raped her.",20,0,84
tughlakabad,2019-09-08,Delhi man absconding in murder case arrested from Gurgaon,murder,"The Delhi Police has arrested a man from neighbouring Gurgaon for allegedly killing a person over a property dispute in the national capital last year, officials said on Sunday.

The accused, Harsh Choudhary alias Rocky, who runs a property business with his uncle, was arrested on Friday. He lived with his father, wife and three children in Kangar Mohalla of Tughlakabad area, the police said.

Choudhary had been declared a proclaimed offender by a Delhi court and a reward of Rs 50,000 announced for his arrest, Deputy Commissioner of Police (Special Cell) P S Kushwah said.

A tip-off was received on Friday that the accused would be coming to meet one of his associates at a hospital in Gurgaon's Sector-56. He was arrested following a brief scuffle with police, the officer said.

Interrogation revealed that Choudhary's uncle, Subhash, and other family members had a dispute over a piece of land with another resident of Kangar Mohalla, Jitu, the DCP said.

On June 8 last year, Jitu along with his family went to Subhash's residence for a settlement but a heated argument broke out between the two parties. The accused and his family attacked Jitu and his family with wooden sticks, he said.

Jitu and his family members suffered serious injuries in the attack. Later, Jitu succumbed to his injuries, he added.

Five relatives of Choudhary were arrested and sent to judicial custody, Kushwah said.

Choudhary's father, Subhash and his two sons are absconding in the case. They have also been declared proclaimed offenders by a court, the police said.",-1,0,84
shalimar bagh,2019-09-09	2019-09-09,"Burglary bid foiled, four arrested in Delhi’s Shalimar Bagh	Four held for burglary bid at gold loan company office in Delhi",burglary	burglary,"The police on Monday arrested four suspected burglars, including a Nepal citizen, and claimed to have foiled a burglary of a gold finance company in northwest Delhi’s Shalimar Bagh. The police said the four men were caught red-handed, while they were breaking a wall of the gold finance company’s office and were about to enter the premises. They had planned to break a locker that contained 18 kilograms of gold, ₹5 lakh and other valuables, the police said. Those arrested were identified as Panchu Ram Mandal, Pheku Basak, Mohijur, of Sahibganj in Jharkhand, and Nirjan Joshi of Nepal. The police recovered a countrymade pistol with one cartridge and house breaking equipment from the four. The deputy commissioner of police (northwest) Vijayanta Arya said that the arrests came during the tenant verification drive in resettlement colonies. During one such drive, a team of the Shalimar Bagh police received information about a few men, who had recently rented a godown and a house. The information was developed and it was learnt that the men were often seen entering a godown, which is to the rear of the gold finance company’s office. Around 2.30pm on Sunday, the team checked around the building and found a man standing outside the godown. Seeing the police party, the man, Joshi, ran inside, but was caught. “Our team members checked the godown and found two men making a hole in the wall using spades. Another man was standing nearby with a spade in his hand. They were arrested,” said Arya. During questioning, the DCP said, the arrested men said they had planned to burgle the gold finance company office with the help of a person who had details of the office and its surroundings.“They rented the godown on rent so that they could bore a hole and enter the finance company office without getting caught. They chose Sunday since it was an off day. We are now looking for the person who played a key role in the planning,” said an investigator.	Four men, including a Nepal national, who allegedly attempted to burgle a gold loan finance company's office in Delhi's Shalimar Bagh were arrested, police said on Monday.

The accused were identified as Panchu Ram Mandal, Pheku Basak, Mohijur, residents of Jharkhand and Nirjan Joshi, a resident of Nepal, they said.

Police got a tip-off about some suspicious persons who had recently moved into the area, following which they checked around the Manappuram Gold loan office on Sunday at around 2.30 pm, a senior police officer said.

""At the office's back side, they saw Joshi standing outside a godown and on seeing the police, he ran inside the godown. Police chased Joshi and apprehended him. They checked inside the godown and found three persons making a manhole and trying to break the wall with help of spades. Later, they were also apprehended,"" said Vijayanta Arya, Deputy Commissioner of Police (Northwest).

Interrogation revealed that the accused hatched a conspiracy with their associate who had a complete knowledge about the finance company's office at Singalpur village in Shalimar Bagh and its surrounding area, the DCP said.

They took a godown, situated behind the Manappuram office, on rent around 10 days ago. They started breaking the wall of godown which led them into the bathroom of the office, the officer said.

They made a manhole inside the wall. The accused were arrested when they were about to enter their targeted office. The lockers in the premises reportedly contained around 18 kg gold and Rs 5 lakh cash along with other valuables, they said.

A case was registered against Kamal Dahiya, the owner of the rented premises, for not conducting tenant verification.

One country-made pistol, one live cartridge and some equipment used for housebreaking were recovered from their possession, police said, adding that efforts are being made to arrest the absconding accused.",-1	-1,0	0,67
