location,date,headline,crime_type,article,age,businessman,percentile
dwarka,2019-09-25	2019-09-25	2019-09-27	2019-09-26	2019-10-01	2019-10-01,"Man arrested, two juveniles apprehended in connection with burglaries at Delhi's Dwarka shops | Delhi News - Times of India	Man arrested, two juveniles apprehended in connection with burglaries at Dwarka shops	Cafe fight led to businessman’s murder in Dwarka: Cops | Delhi News - Times of India	23-yr-old held for Dwarka property dealer murder	4 arrested by Delhi Police for involvement in extortion, murder cases	Police arrest four people involved in several cases of extortion and murder",burglary	burglary	murder	murder	murder	murder,"Picture used for representational purpose only

NEW DELHI: A man was arrested and two juveniles were apprehended in connection with burglaries at four shops in Dwarka , police said on Wednesday.The accused Saddam was arrested while the two juveniles aged 16 and 17 were apprehended from Dwarka area, police said, adding raids are being conducted to trace the fourth accused involved in the burglaries.According to police, the incidents took place on the intervening night of September 23 and 24. The accused broke open the shutters of the four shops located in sector-10 market area of Dwarka and ransacked the premises.In the CCTV footage, Saddam, resident of Begusarai Bihar ) and other accused were seen breaking the shutters of the shops, a police official said.Five stolen laptops, a projector, DVR and one LCD was recovered from them, he added.	A man was arrested and two juveniles were apprehended in connection with burglaries at four shops in Dwarka, police said on Wednesday.

The accused -- Saddam was arrested while the two juveniles aged 16 and 17 were apprehended from Dwarka area, police said, adding raids are being conducted to trace the fourth accused involved in the burglaries.

According to police, the incidents took place on the intervening night of September 23 and 24. The accused broke open the shutters of the four shops located in sector-10 market area of Dwarka and ransacked the premises.

In the CCTV footage, Saddam, resident of Begusarai (Bihar) and other accused were seen breaking the shutters of the shops, a police official said.

Five stolen laptops, a projector, DVR and one LCD was recovered from them, he added.	In the CCTV footage, Nakul Sangwan can be seen climbing a car parked near the businessman’s car to shoot him d...

Accused Says They Got Thrashed At Cafe

NEW DELHI: The sensational murder of a property dealer turned politician, who was shot dead in Dwarka on Tuesday by two assailants in a daring attack captured on CCTV camera, was a fallout of a fight that took place in a cafe run by the victim, police said after arresting one of the alleged shooters on Thursday.The victim, Narendra Gehlot, had contested the last municipal elections as an independent and lost. He had slapped the shooter, Nakul Sangwan, at his cafe after locking him up following an altercation, police said. Sangwan, who is the cousin of gangster Kapil Sangwan, was nursing a grudge against Gehlot ever since, and decided to eliminate him to avenge the insult, police added.Police arrested Sangwan near Dwarka on Thursday after laying a trap. DCP (Dwarka) Anto Alphonse said a team led by ACP Rajinder Singh confronted Sangwan near Goyla Dairy. When he saw the police team, Sangwan tried to whip out his pistol and fire but was overpowered by the team. The .32 bore pistol he had used for the murder was recovered from him.Cops found that Sangwan was earlier involved in another murder in Aman Vihar near Rohini. The victim was a youth named Pushkar, whom Sangwan suspected of passing on information to his rivals about the movement of the family members of one of his associates. That murder too was captured in a CCTV camera.During interrogation, Sangwan told the cops that in July this year, he and his friend Rohit had gone to a cafe run by Gehlot’s relatives on the third floor of his office near Dwarka More. Rohit had a running dispute with Gehlot and his relative, claiming that he had lent them money for the cafe which Gehlot had refused to return.Finding them sitting in the cafe, Gehlot challenged them which led to an argument during which he allegedly shut the door and called in a few of his employees to thrash Sangwan and Rohit. Angered by the insult, Sangwan was looking for an oppurtunity to take revenge and had kept a watch outside Gehlot’s shop to track his movements, police said.On Tuesday, he and one of his associates waylaid Gehlot while he was leaving his shop, and started firing at his car. When Gehlot tried to flee, Sangwan climbed on a car parked near Gehlot’s car and shot him dead.Sangwan told cops that he had dropped out of a Haryana college while pursuing a BSc course. He was inspired by his cousin Kapil, who has been absconding for the past few years. He had joined Kapil’s gang and was a notorious sharpshooter of the Nandu gang. He was arrested last year in a murder case at Baba Haridass Nagar, and was released from the jail in June 2019. Sangwan had started extorting money from businessmen in Dwarka and adjoning areas.Police are now on the lookout for his associate, who had also fired at Gehlot.	New Delhi The Delhi Police on Thursday said they have arrested a 23-year-old man for the murder of property dealer who was shot multiple times in Dwarka on Tuesday.The suspect, who police identified as Nakul Sangwan, is a relative of the second suspect Kapil Sangwan alias Nandu who is absconding. Nakul and Kapil are suspected of gunning down 52-year-old Narender alias Ninty who had allegedly slapped Kapil’s brother in July, said a police officer not authorised to speak to the media. The murder is suspected to be a fallout of that incident. Nakul Sangwan alias Deepak, a permanent resident of Mahendragarh in Haryana, has cases of murder, attempts to murder and illegal possession of arms registered against him. He was also arrested in a murder case last year and was released from jail in June 2019.Deputy commissioner of police (Dwarka) Anto Alphonse said that they received information at Dwarka North police station on Tuesday reporting that a man was shot outside his office in Kakrola village at around 4 pm. He was rushed to hospital where he succumbed to his injuries.A CCTV footage of the attack was also widely shared on social media in which a man with his face cover is seen shooting at Narender as he got into his car. The video shows Narender trying to flee but assailant chases him and shot him repeatedly.Alphonse said they had registered a case of murder on the complaint of aa person named Pradeep Dhaka, a relative of Narender, who was also an eye witness to the murder. “Preliminary probe revealed that Dhaka owned a café on the top floor of Narender’s office building. We came to know that a few months back a quarrel took place at the café between Narender and Nakul Sangwan. During the scuffle, Narender had even slapped Nakul Sangwan and thrashed some of his aides,” the DCP said.He said they began a looking into Nakul Sangwan and within hours, they got information that he would come to Sector 18 in Dwarka on a motorcycle on Wednesday.“On this input, a team laid trap and soon as Nakul was spotted, our team asked him to surrender. Seeing the police, the man took out his pistol and tried to shoot at the team, but was overpowered in time. A loaded pistol was recovered from him. The motorcycle he was using was also found to be stolen from Dwarka,” the officer said.“He said he was miffed after Narender slapped him and wanted to revenge. We have also identified the other assailant and efforts to identify him are underway,” he said.	Delhi Police on Tuesday said that a team of Anti-Auto Theft Squad (AATS) arrested four men who were involved in several extortion and murder cases after a brief exchange of fire.

Four pistols and 23 live cartridges were also seized from the arrested.

The encounter took place on September 30.

While addressing the press, Deputy Commissioner of Police (DCP), Anto Alphonse said, ""Four criminals were arrested and three sophisticated pistols, one country-made pistol and 23 live cartridges recovered along with one Fortuner car and one robbed Enfield Bullet Motorcycle.""

""As a part of the commitment to fight crime, AATS of Dwarka district was tracking the criminals in the area. On September 30, the team swung into action immediately after they received the information and laid a trap near Chhawla Stand, Najafgarh. The criminals fired upon police when asked to surrender so police in their defence retaliated,"" the DCP added.

Later, all four accused were arrested. Efforts are being made to arrest their associate, who is on the run after jumping his interim bail in June this year.	Four people involved in several cases of extortion and murder were arrested after a brief exchange of fire in Dwarka's Chhawla area, police said on Tuesday.

The accused have been identified as Gulshan Khati (23), Amit Gulia (25), Krishan Kumar (30) and Anil Bhattar (25).

While Khati, Gulia and Kumar are residents of Najfgarh, Bhattar hails from Jhajjar district in Haryana, they said.

""On Monday, the police arrested the accused near Chhawla stand in Najafgarh at around 5:40 PM after a brief exchange of fire.

""All the accused were sharpshooters. Four pistols, 23 live cartridges, one car and a bike were recovered from their possession,"" said Anto Alphonse, Deputy Commissioner of Police (Dwarka).

Khati, Kumar and Gulia were involved in separate cases and were lodged in jail. They had got interim bail but had not surrendered, police said.

Bhattar was arrested in connection with a murder and robbery case in Haryana in 2010. He remained in jail for nine years and was just released nine days ago, they added.",-1	-1	-1	23	-1	-1,0	0	1	1	0	0,0
kakrola,2019-09-26,23-yr-old held for Dwarka property dealer murder,murder,"New Delhi The Delhi Police on Thursday said they have arrested a 23-year-old man for the murder of property dealer who was shot multiple times in Dwarka on Tuesday.The suspect, who police identified as Nakul Sangwan, is a relative of the second suspect Kapil Sangwan alias Nandu who is absconding. Nakul and Kapil are suspected of gunning down 52-year-old Narender alias Ninty who had allegedly slapped Kapil’s brother in July, said a police officer not authorised to speak to the media. The murder is suspected to be a fallout of that incident. Nakul Sangwan alias Deepak, a permanent resident of Mahendragarh in Haryana, has cases of murder, attempts to murder and illegal possession of arms registered against him. He was also arrested in a murder case last year and was released from jail in June 2019.Deputy commissioner of police (Dwarka) Anto Alphonse said that they received information at Dwarka North police station on Tuesday reporting that a man was shot outside his office in Kakrola village at around 4 pm. He was rushed to hospital where he succumbed to his injuries.A CCTV footage of the attack was also widely shared on social media in which a man with his face cover is seen shooting at Narender as he got into his car. The video shows Narender trying to flee but assailant chases him and shot him repeatedly.Alphonse said they had registered a case of murder on the complaint of aa person named Pradeep Dhaka, a relative of Narender, who was also an eye witness to the murder. “Preliminary probe revealed that Dhaka owned a café on the top floor of Narender’s office building. We came to know that a few months back a quarrel took place at the café between Narender and Nakul Sangwan. During the scuffle, Narender had even slapped Nakul Sangwan and thrashed some of his aides,” the DCP said.He said they began a looking into Nakul Sangwan and within hours, they got information that he would come to Sector 18 in Dwarka on a motorcycle on Wednesday.“On this input, a team laid trap and soon as Nakul was spotted, our team asked him to surrender. Seeing the police, the man took out his pistol and tried to shoot at the team, but was overpowered in time. A loaded pistol was recovered from him. The motorcycle he was using was also found to be stolen from Dwarka,” the officer said.“He said he was miffed after Narender slapped him and wanted to revenge. We have also identified the other assailant and efforts to identify him are underway,” he said.",23,1,84
najafgarh,2019-10-01	2019-10-01,"4 arrested by Delhi Police for involvement in extortion, murder cases	Police arrest four people involved in several cases of extortion and murder",murder	murder,"Delhi Police on Tuesday said that a team of Anti-Auto Theft Squad (AATS) arrested four men who were involved in several extortion and murder cases after a brief exchange of fire.

Four pistols and 23 live cartridges were also seized from the arrested.

The encounter took place on September 30.

While addressing the press, Deputy Commissioner of Police (DCP), Anto Alphonse said, ""Four criminals were arrested and three sophisticated pistols, one country-made pistol and 23 live cartridges recovered along with one Fortuner car and one robbed Enfield Bullet Motorcycle.""

""As a part of the commitment to fight crime, AATS of Dwarka district was tracking the criminals in the area. On September 30, the team swung into action immediately after they received the information and laid a trap near Chhawla Stand, Najafgarh. The criminals fired upon police when asked to surrender so police in their defence retaliated,"" the DCP added.

Later, all four accused were arrested. Efforts are being made to arrest their associate, who is on the run after jumping his interim bail in June this year.	Four people involved in several cases of extortion and murder were arrested after a brief exchange of fire in Dwarka's Chhawla area, police said on Tuesday.

The accused have been identified as Gulshan Khati (23), Amit Gulia (25), Krishan Kumar (30) and Anil Bhattar (25).

While Khati, Gulia and Kumar are residents of Najfgarh, Bhattar hails from Jhajjar district in Haryana, they said.

""On Monday, the police arrested the accused near Chhawla stand in Najafgarh at around 5:40 PM after a brief exchange of fire.

""All the accused were sharpshooters. Four pistols, 23 live cartridges, one car and a bike were recovered from their possession,"" said Anto Alphonse, Deputy Commissioner of Police (Dwarka).

Khati, Kumar and Gulia were involved in separate cases and were lodged in jail. They had got interim bail but had not surrendered, police said.

Bhattar was arrested in connection with a murder and robbery case in Haryana in 2010. He remained in jail for nine years and was just released nine days ago, they added.",-1	-1,0	0,67
prem nagar,2019-10-01,Two murders in less than 12 hours in Delhi,murder,"A 22-year-old alleged bootlegger was shot dead in front of his brother by man and his two associates in outer Delhi’s Prem Nagar on Monday night, the police said. The victim had allegedly slapped and humiliated the man in public for demanding free liquor. The suspects were arrested on Tuesday evening and were booked for murder at the Prem Nagar police station. They were identified as Manish alias Monu,23, Neeraj,22, and Niraj,20. Manish, the prime suspect, took revenge on Ashish Kumar allegedly slapping and humiliating him a fortnight ago, police said. Kumar was living in a rented house with his live-in partner in Prem Nagar Part-2 for the last three years. He was disowned by his family for running an illegal liquor business, the police said.Deputy commissioner of police (Rohini) SD Mishra said that police on Monday night received information that a man was shot by some men. A police team found Kumar with a gunshot injury below his chest. He was rushed to a nearby hospital where he was declared brought dead. “Kumar’s brother, Shivam, was an eyewitness to the crime and identified the suspects. Raids were conducted and the three suspects were caught from different places in outer Delhi,” said a police officer, associated with the case.Manish told police that around a fortnight ago, Kumar had slapped him when he asked for a bottle of liquor for free. “Manish decided to kill him. He convinced his two friends for assistance and they executed the murder plan on Monday night,” the officer added.In another incident, two bike-borne men allegedly shot a 27-year old contractual labourer in his face in east Delhi’s Kalyanpuri on Tuesday morning. Police suspect monetary dispute behind the murder. Locals told police that the duo shot him as he stopped them from creating a ruckus in the neighbourhood and objected to their abuses. One of the alleged attackers, Guddu, was caught by the public, who thrashed him and set his bike on fire before handing him over to the police. The man who was killed was identified as Jaspal. Police said they received a call around 5am reporting that a man has been shot dead. Jaspal, who works as a labourer at construction sites, was rushed to hospital where he succumbed to his injuries. Locals told police that they saw the two men brandishing gun while making their way through the narrow lanes. Jaspal raised objections and tried to stop the bikers. As he tried to overpower them, one of the two shot him in his face. As they tried to flee, locals caught Guddu and set the bike on fire. Deputy commissioner of police (east) Jasmeet Singh said Guddu was arrested.",22,0,84
saket,2019-09-30,Two arrested for kidnapping 12-day-old baby in south Delhi,kidnapping,"A 29-year-old woman and a man were arrested for allegedly kidnapping a 12-day-old baby in the national capital, police said on Monday.

Ruby Khatoon was arrested from Saket while her accomplice Shah Mohammad was nabbed from Sangam Vihar area and the child was recovered, police said.

Khattoon had took the baby of her co-worker Meenakshi Sharma on the pretext of taking care of him, the police said.

In her complaint, Sharma told police, Ruby Khatoon and I worked in the same store. After I told her that I was pregnant, she told me that she wants a baby but couldn't conceive one. Later, she introduced me to her husband Rakesh Kumar. They told me that they wanted to take care of the baby and helped me during pregnancy. On September 17, I delivered the baby in a hospital in Delhi. On the same day, they asked to take away the baby. They told me that it was only for a few days and that I could contact them at any time. I gave them my child but after sometime when I tried to contact them they wouldn't take my calls.

The woman then searched for Khatoon and her husband. Through the neighbours, she came to know that Ruby wasn't married, the police said.

I came to know that she was in Saket Court with a man. I went there and saw her with Kumar. I confronted her about my child but she refused to tell me anything, said Sharma.

Atul Kumar Thakur, DCP (South) said, ""We received a complaint that two women were fighting outside the court. The officers rushed to the court and found that Sharma's baby was kidnapped. We arrested Ruby who later told us that she gave the child to a man named Shah Mohammad. The man was arrested from Sangam Vihar and the baby was recovered from his possession.

The police said that Ruby went to the court to get married to Kumar.

Ruby and Mohammad have been arrested and a case of kidnapping has been registered at the Saket police station while Kumar is being questioned, police added.",29,0,84
pitampura,2019-10-03	2019-10-03,"Delhi: Wanted in a robbery case, man arrested after he uploads picture on Facebook | Delhi News - Times of India	Wanted in a robbery case, man arrested after he uploads picture on Facebook",robbery	robbery,"NEW DELHI: A 21-year old man found himself in jail after he uploaded a picture of himself on vacation in Shimla that he had funded by allegedly robbing three people at gunpoint in a Delhi suburb, police said on Thursday.The accused has been identified as Subham, who was arrested from a market in Shimla after he uploaded his picture on Facebook He along with his friend and an acquaintance had planned and executed a robbery on September 23 to finance the trip to Shimla, they said. Mohit Singh lodged a complaint with the police and alleged that he was robbed by three persons of Rs 1,500. He also alleged that the miscreants robbed Rs 23,000 from his uncle and around Rs 2,500 from a locker of the shop at Rohini sector-3 at gunpoint.The incident took place at around 9.30pm when the victims were busy closing the shop, police said.When they were about to close the shop, two men entered while one stood outside. They started thrashing Singh and his uncle and took away cash at gunpoint before fleeing the spot, a police official said.During investigation, police detained some of the friends of the accused. The friends told the police that Subham and his associates were in Shimla on a holiday and had also uploaded a picture on Facebook, the official said.""Subham, a resident of Pitampura was arrested from Shimla. Efforts are being made to nab his associates,"" said Deputy Commissioner of Police (Rohini) SD Mishra.During interrogation, the accused disclosed that they had planned and executed the crime to finance their sight seeing trip to Shimla, the officer said.The accused was arrested earlier as well in a robbery case, the officer added.	A 21-year old man found himself in jail after he uploaded a picture of himself on vacation in Shimla that he had funded by allegedly robbing three people at gunpoint in a Delhi suburb, police said on Thursday.

The accused has been identified as Subham, who was arrested from a market in Shimla after he uploaded his picture on Facebook.

He along with his friend and an acquaintance had planned and executed a robbery on September 23 to finance the trip to Shimla, they said.

Mohit Singh lodged a complaint with the police and alleged that he was robbed by three persons of Rs 1,500. He also alleged that the miscreants robbed Rs 23,000 from his uncle and around Rs 2,500 from a locker of the shop at Rohini sector-3 at gunpoint.

The incident took place at around 9.30 pm when the victims were busy closing the shop, police said.

When they were about to close the shop, two men entered while one stood outside.

They started thrashing Singh and his uncle and took away cash at gunpoint before fleeing the spot, a police official said.

During investigation, police detained some of the friends of the accused. The friends told the police that Subham and his associates were in Shimla on a holiday and had also uploaded a picture on Facebook, the official said.

""Subham, a resident of Pitampura was arrested from Shimla. Efforts are being made to nab his associates,"" said Deputy Commissioner of Police (Rohini) SD Mishra.

During interrogation, the accused disclosed that they had planned and executed the crime to finance their sight seeing trip to Shimla, the officer said.

The accused was arrested earlier as well in a robbery case, the officer added.",-1	-1,0	0,67
lajpat nagar,2019-10-03,Three people arrested in connection with burglary in Lajpat Nagar,burglary,"A domestic help, her husband and an accomplice have been arrested in connection with a burglary at a house in southeast Delhi's Lajpat Nagar area, police said on Thursday.

The accused were identified as Fatima (34), her husband Mohmood (37), both residents of Sarai Kale Khan, and Mohammad Zakir (35), resident of Taimoor Nagar, they said.

According to the police, the two men conspired and planned to target vacant houses during day-time, while Fatima, who worked as domestic help in the residential areas of Lajpat Nagar, conducted recce and passed information to them.

On September 29, police said they received a complaint about theft of Rs 50 lakhs, diamond and gold jewellery along with expensive wrist watch and other valuable articles from a house at National Park area, Lajpat Nagar, and a case was registered at Amar Colony police station.

The accused were seen in a CCTV footage leaving the spot in an e-rickshaw after committing the burglary, the police said.

On Tuesday, a raid was conducted at Taimoor Nagar and Sarai Kale Khan areas and the accused were arrested, said Deputy Commissioner of Police (Southeast) Chinmoy Biswal.

Later, Fatima was also arrested in connection with the incident, the officer said.

Stolen cash amounting to Rs 31.91 lakh, gold and diamond jewellery, laptop, mobile, e-rickshaw and tools were recovered from them, the officer added.

Mahmood and Zakir were previously involved in several cases of burglaries and theft. Both were arrested in March in connection with a similar burglary incident and released from jail in August.",-1,1,84
